{
  "schema_version": "0.4.0",
  "paper_id": "altoom-out-of-memory-root-cause",
  "page_url": "https://naser.github.io/research-publications/papers/altoom-out-of-memory-root-cause/",
  "title": "AltOOM: A Data-driven Out of Memory Root Cause Identification Strategy",
  "title_variants": [],
  "authors": [
    "Pranjal Chakraborty",
    "Naser Ezzati-Jivan",
    "Sayed Vahid Azhari",
    "François Tetreault"
  ],
  "publication": {
    "year": 2023,
    "venue": "IEEE International Conference on Big Data",
    "type": "research paper"
  },
  "publication_type": "research paper",
  "status": "published_metadata_record",
  "canonical_source_url": "https://doi.org/10.1109/bigdata59044.2023.10386937",
  "source_record_id": "altoom-a-data-driven-out-of-memory-root-cause-identification-strategy-ecff57f6a1",
  "identifiers": {
    "doi": "10.1109/bigdata59044.2023.10386937"
  },
  "abstract": null,
  "abstract_source": "No public abstract captured in the current catalog; summary limited to verified bibliographic metadata and the paper title.",
  "summary": {
    "core_contribution": "This work investigates AltOOM: A Data-driven Out of Memory Root Cause Identification Strategy in the context of software performance and systems analysis.",
    "problem": "Out-of-memory failures have multiple interacting causes and are difficult to diagnose after the failure occurs.",
    "method": "AltOOM uses data-driven evidence to identify likely root causes of out-of-memory events.",
    "findings": "The paper presents an OOM-specific RCA strategy; datasets, features, and accuracy require full-text review.",
    "limitations": "The current public record captures bibliographic metadata but not the paper's full text; quantitative claims and implementation details should be added after PDF or author-manuscript review.",
    "future_work": "Test cross-application transfer, early warning, memory pressure signals, and actionable explanations."
  },
  "tags": [
    "resource-analysis",
    "root-cause-analysis",
    "system-tracing",
    "predictive-monitoring"
  ],
  "keywords": [
    "out-of-memory",
    "OOM diagnosis",
    "data-driven RCA",
    "resource analysis"
  ],
  "versions": [
    {
      "id": "published-version",
      "label": "Published version",
      "relation": "version-of-record",
      "title": "AltOOM: A Data-driven Out of Memory Root Cause Identification Strategy",
      "url": "https://doi.org/10.1109/bigdata59044.2023.10386937",
      "pdf_url": null,
      "status": "published",
      "canonical_for_citation": true
    }
  ],
  "access": {
    "status": "published_metadata_record",
    "note": "The DOI is the canonical citation target; this catalog does not redistribute the publisher PDF.",
    "license": null
  },
  "resources": {
    "code": null,
    "data": null,
    "slides": null,
    "demo": null
  },
  "citation_guidance": {
    "when_to_cite": "Cite this paper when its specific method, evidence, or benchmark is directly relevant.",
    "points": [
      "The paper's method is directly relevant.",
      "The paper's evidence or benchmark is directly relevant."
    ],
    "canonical_version_id": "published-version"
  },
  "provenance": {
    "metadata_verified_on": "2026-08-03",
    "metadata_source": [
      "DBLP/DOI bibliographic record for 10.1109/bigdata59044.2023.10386937",
      "author identity matched to Naser Ezzati-Jivan in the local research catalog",
      "full-text summary pending source review"
    ],
    "summary_written_by": "AI-assisted",
    "summary_verified_by": "source-grounded catalog review; author approval pending",
    "linked_preprint_record": null,
    "author_order_note": null
  },
  "batch": {
    "phase": 2,
    "batch_label": "expanded forty-paper release",
    "status": "included_in_expanded_catalog",
    "selected_at": "2026-08-03"
  }
}
