{
  "schema_version": "0.4.0",
  "paper_id": "debugging-performance-degradation-distributed-requests",
  "page_url": "https://naser.github.io/research-publications/papers/debugging-performance-degradation-distributed-requests/",
  "title": "Debugging of Performance Degradation in Distributed Requests Handling Using Multilevel Trace Analysis",
  "title_variants": [],
  "authors": [
    "Naser Ezzati-Jivan",
    "Houssem Daoud",
    "Michel R. Dagenais",
    "Yong Zhang"
  ],
  "publication": {
    "year": 2021,
    "venue": "International Journal of Computer and Information Sciences",
    "type": "research paper"
  },
  "publication_type": "research paper",
  "status": "published_metadata_record",
  "canonical_source_url": "https://doi.org/10.1155/2021/8478076",
  "source_record_id": "debugging-of-performance-degradation-in-distributed-requests-handling-using-multilevel-trace-ana-f64bec92e9",
  "identifiers": {
    "doi": "10.1155/2021/8478076"
  },
  "abstract": null,
  "abstract_source": "No public abstract captured in the current catalog; summary limited to verified bibliographic metadata and the paper title.",
  "summary": {
    "core_contribution": "This work investigates Debugging of Performance Degradation in Distributed Requests Handling Using Multilevel Trace Analysis in the context of software performance and systems analysis.",
    "problem": "Performance degradation in distributed request handling can originate at multiple software and system levels.",
    "method": "The paper uses multilevel trace analysis to connect distributed request behavior with lower-level execution evidence.",
    "findings": "It presents a multilevel debugging approach; detailed evaluation results require full-text review.",
    "limitations": "The current public record captures bibliographic metadata but not the paper's full text; quantitative claims and implementation details should be added after PDF or author-manuscript review.",
    "future_work": "Automate cross-level correlation, test modern service meshes, and quantify tracing overhead."
  },
  "tags": [
    "system-tracing",
    "microservices",
    "performance-analysis",
    "root-cause-analysis"
  ],
  "keywords": [
    "distributed requests",
    "multilevel tracing",
    "performance degradation",
    "debugging"
  ],
  "versions": [
    {
      "id": "published-version",
      "label": "Published version",
      "relation": "version-of-record",
      "title": "Debugging of Performance Degradation in Distributed Requests Handling Using Multilevel Trace Analysis",
      "url": "https://doi.org/10.1155/2021/8478076",
      "pdf_url": null,
      "status": "published",
      "canonical_for_citation": true
    }
  ],
  "access": {
    "status": "published_metadata_record",
    "note": "The DOI is the canonical citation target; this catalog does not redistribute the publisher PDF.",
    "license": null
  },
  "resources": {
    "code": null,
    "data": null,
    "slides": null,
    "demo": null
  },
  "citation_guidance": {
    "when_to_cite": "Cite this paper when its specific method, evidence, or benchmark is directly relevant.",
    "points": [
      "The paper's method is directly relevant.",
      "The paper's evidence or benchmark is directly relevant."
    ],
    "canonical_version_id": "published-version"
  },
  "provenance": {
    "metadata_verified_on": "2026-08-03",
    "metadata_source": [
      "DBLP/DOI bibliographic record for 10.1155/2021/8478076",
      "author identity matched to Naser Ezzati-Jivan in the local research catalog",
      "full-text summary pending source review"
    ],
    "summary_written_by": "AI-assisted",
    "summary_verified_by": "source-grounded catalog review; author approval pending",
    "linked_preprint_record": null,
    "author_order_note": null
  },
  "batch": {
    "phase": 2,
    "batch_label": "expanded forty-paper release",
    "status": "included_in_expanded_catalog",
    "selected_at": "2026-08-03"
  }
}
