{
  "schema_version": "0.4.0",
  "paper_id": "performance-evaluation-multithread-execution-paths",
  "page_url": "https://naser.github.io/research-publications/papers/performance-evaluation-multithread-execution-paths/",
  "title": "Performance Evaluation of Complex Multi-Thread Applications Through Execution Path Analysis",
  "title_variants": [],
  "authors": [
    "Majid Rezazadeh",
    "Naser Ezzati-Jivan",
    "Seyed Vahid Azhari",
    "Michel R. Dagenais"
  ],
  "publication": {
    "year": 2022,
    "venue": "Performance Evaluation",
    "type": "research paper"
  },
  "publication_type": "research paper",
  "status": "published_metadata_record",
  "canonical_source_url": "https://doi.org/10.1016/j.peva.2022.102289",
  "source_record_id": "performance-evaluation-of-complex-multi-thread-applications-through-execution-path-analysis-d1e6144c22",
  "identifiers": {
    "doi": "10.1016/j.peva.2022.102289"
  },
  "abstract": null,
  "abstract_source": "No public abstract captured in the current local catalog; summary limited to verified bibliographic metadata and the paper title.",
  "summary": {
    "core_contribution": "This work investigates execution-path analysis as a way to evaluate complex multi-thread applications.",
    "problem": "Concurrency creates many execution paths whose interactions can obscure the causes of performance variation.",
    "method": "The paper analyzes application execution paths to characterize performance in complex multi-threaded software.",
    "findings": "The study contributes an execution-path perspective for performance evaluation; algorithms, workloads, and quantitative findings require full-text review.",
    "limitations": "The current catalog captures bibliographic evidence but not the full text; quantitative results, implementation details, and paper-specific validity threats require source review.",
    "future_work": "Scale path analysis, handle path explosion, and connect path-level evidence to actionable optimization decisions."
  },
  "tags": [
    "performance-analysis",
    "trace-analysis",
    "multicore-systems",
    "performance-engineering"
  ],
  "keywords": [
    "multi-thread applications",
    "execution paths",
    "performance evaluation",
    "thread behavior"
  ],
  "versions": [
    {
      "id": "published-version",
      "label": "Published version",
      "relation": "version-of-record",
      "title": "Performance Evaluation of Complex Multi-Thread Applications Through Execution Path Analysis",
      "url": "https://doi.org/10.1016/j.peva.2022.102289",
      "pdf_url": null,
      "status": "published",
      "canonical_for_citation": true
    }
  ],
  "access": {
    "status": "published_metadata_record",
    "note": "The DOI is the canonical citation target; this catalog does not redistribute the publisher PDF.",
    "license": null
  },
  "resources": {
    "code": null,
    "data": null,
    "slides": null,
    "demo": null
  },
  "citation_guidance": {
    "when_to_cite": "Cite this paper when its specific method, evidence, or benchmark is directly relevant.",
    "points": [
      "The paper's method is directly relevant.",
      "The paper's evidence or benchmark is directly relevant."
    ],
    "canonical_version_id": "published-version"
  },
  "provenance": {
    "metadata_verified_on": "2026-08-07",
    "metadata_source": [
      "Crossref and local DBLP/venue metadata for 10.1016/j.peva.2022.102289",
      "author identity matched to Naser Ezzati-Jivan in the local research catalog",
      "full-text summary pending source review"
    ],
    "summary_written_by": "AI-assisted",
    "summary_verified_by": "source-grounded catalog review; author approval pending",
    "linked_preprint_record": null,
    "author_order_note": null
  },
  "batch": {
    "phase": 2,
    "batch_label": "expanded forty-paper release",
    "status": "included_in_expanded_catalog",
    "selected_at": "2026-08-07"
  }
}
