{
  "schema_version": "0.4.0",
  "paper_id": "performance-anomaly-detection-sequence-alignment",
  "page_url": "https://naser.github.io/research-publications/papers/performance-anomaly-detection-sequence-alignment/",
  "title": "Performance anomaly detection through sequence alignment of system-level traces",
  "title_variants": [],
  "authors": [
    "Madeline Janecek",
    "Naser Ezzati-Jivan",
    "Abdelwahab Hamou-Lhadj"
  ],
  "publication": {
    "year": 2022,
    "venue": "ACM/SPEC International Conference on Performance Engineering (ICPE)",
    "type": "research paper"
  },
  "publication_type": "research paper",
  "status": "published_metadata_record",
  "canonical_source_url": "https://doi.org/10.1145/3524610.3527898",
  "source_record_id": "performance-anomaly-detection-through-sequence-alignment-of-system-level-traces-e36cd46801",
  "identifiers": {
    "doi": "10.1145/3524610.3527898"
  },
  "abstract": null,
  "abstract_source": "No public abstract captured in the current catalog; summary limited to verified bibliographic metadata and the paper title.",
  "summary": {
    "core_contribution": "This work investigates Performance anomaly detection through sequence alignment of system-level traces in the context of software performance and systems analysis.",
    "problem": "Anomalous executions may differ from normal executions in timing and event order, making simple threshold detection insufficient.",
    "method": "The approach uses sequence alignment over system-level traces to compare executions and detect anomalous behavior.",
    "findings": "The paper develops a trace-sequence-alignment direction for performance anomaly detection; quantitative findings require full-text review.",
    "limitations": "The current public record captures bibliographic metadata but not the paper's full text; quantitative claims and implementation details should be added after PDF or author-manuscript review.",
    "future_work": "Scale alignment, handle concurrency and sampling, and separate anomaly detection from root-cause explanation."
  },
  "tags": [
    "system-tracing",
    "anomaly-detection",
    "performance-analysis",
    "trace-analysis"
  ],
  "keywords": [
    "sequence alignment",
    "system-level traces",
    "performance anomalies",
    "trace comparison"
  ],
  "versions": [
    {
      "id": "published-version",
      "label": "Published version",
      "relation": "version-of-record",
      "title": "Performance anomaly detection through sequence alignment of system-level traces",
      "url": "https://doi.org/10.1145/3524610.3527898",
      "pdf_url": null,
      "status": "published",
      "canonical_for_citation": true
    }
  ],
  "access": {
    "status": "published_metadata_record",
    "note": "The DOI is the canonical citation target; this catalog does not redistribute the publisher PDF.",
    "license": null
  },
  "resources": {
    "code": null,
    "data": null,
    "slides": null,
    "demo": null
  },
  "citation_guidance": {
    "when_to_cite": "Cite this paper when its specific method, evidence, or benchmark is directly relevant.",
    "points": [
      "The paper's method is directly relevant.",
      "The paper's evidence or benchmark is directly relevant."
    ],
    "canonical_version_id": "published-version"
  },
  "provenance": {
    "metadata_verified_on": "2026-08-03",
    "metadata_source": [
      "DBLP/DOI bibliographic record for 10.1145/3524610.3527898",
      "author identity matched to Naser Ezzati-Jivan in the local research catalog",
      "full-text summary pending source review"
    ],
    "summary_written_by": "AI-assisted",
    "summary_verified_by": "source-grounded catalog review; author approval pending",
    "linked_preprint_record": null,
    "author_order_note": null
  },
  "batch": {
    "phase": 2,
    "batch_label": "expanded forty-paper release",
    "status": "included_in_expanded_catalog",
    "selected_at": "2026-08-03"
  }
}
